{
  "contract_version": "growth.verified_r29_r34_model_review.r30.v1",
  "evidence_state": "FIXTURE_VERIFIED",
  "review_id": "fixture-review-b",
  "r29": {
    "producer_sha": "3e4a8ad6d73b058c953abeadba7a60abe567adbc",
    "ci_run_id": 37195373334,
    "artifact_id": 11301225456,
    "artifact_digest": "sha256:40fb5e5c7ab7ccf7a02514f9b5a40eb8fc3207373c63391a17606fb12a6d0e55",
    "round_result_contract": "growth.exact_session_round_result.r29.v1",
    "round_result_file": "payload/r29-result-b.json",
    "round_result_file_sha256": "13afd684c9430d86acf60ee63a88a35c5266fdf643e5ce2feeb8cde7f090f844",
    "session_id": "fixture-r30-consensus-session"
  },
  "media_r24": {
    "producer_sha": "244acdf154741e669991b17df3ef2a47e2dfdfa9",
    "ci_run_id": 37195239582,
    "artifact_id": 11301055747,
    "artifact_digest": "sha256:fc5c9b9635d49b643e66efafe602d21ce1ef695a553f81a797bdf16d7b8cf228",
    "session_id": "r23-real-session",
    "session_identity": "e53c6c45febf4a1281de6902a77a0795011bdb99f4e7aec25afeae516ee74560",
    "package_digest": "65b591b7991cc4b0c4fa5ecbabda2d7bb58418b873792ce55f92c93cd08fc470",
    "review_round": 0,
    "prompt_digest": "2f79d24571f0e9d0fb051702678125d6b50308323aab0923b154ee7e16b3c9d2",
    "prompt_size": 678,
    "sealed_mapping_digest": "01cef4f83ebf90c9fd11d058251a27daef2fc76b276c170b86e32d7fc98b1fa6",
    "attachments": [
      {
        "blindLabel": "A",
        "relativePath": "review-A.mp4",
        "sha256": "70fdc25373b544b98aad4f8b5180fc56e69aea9ce11c3d5fb65b08ac02c50cb2",
        "size": 787963,
        "mime": "video/mp4"
      },
      {
        "blindLabel": "B",
        "relativePath": "review-B.mp4",
        "sha256": "1855a1745d53329294c680600299a9ca0308a7c468b27d6dab94d21a72605054",
        "size": 795358,
        "mime": "video/mp4"
      }
    ],
    "r29_package_digest": "6a7b79f617de400a4a086e64a0cae9feceafa51a9a324074e85fb07ebf58dfc9"
  },
  "bridge_r34": {
    "producer_sha": "4e2a37545cc0cdd940cf6e86d40e0d620d6c94ae",
    "ci_run_id": 37196102639,
    "capture_contract": "bridge.existing_chat_video_review_capture.v1",
    "result_contract": "bridge.existing_chat_video_review_result.v1",
    "routing_authority": "providerConversationId",
    "provider_conversation_id": "r30-review-b",
    "conversation_id": "r30-review-b",
    "canonical_url": "https://chatgpt.com/c/r30-review-b",
    "request_id": "r30-request-b",
    "operation_id": "r30-operation-b",
    "capture_digest": "547a243c75e229afee4ddb5297dc479c87bb240614c88b1acead3545193a78be",
    "response_digest": "04d2757e0ff1a68f5400690270f590416270f48c01a4c13d4900475113a221cb",
    "response_file": "responses/reviewer-b.json",
    "response_file_sha256": "04d2757e0ff1a68f5400690270f590416270f48c01a4c13d4900475113a221cb"
  },
  "model_metadata": {
    "provider": "fixture-provider-2",
    "model": "fixture-model-beta",
    "metadata": {
      "fixture": true,
      "temperature": 0
    }
  },
  "inner_envelopes": {
    "A": {
      "relative_path": "payload/envelope-b-a.json",
      "sha256": "551b34e9c3a9280c004432cfb3246879f767a0aca9656237ef463de7fb8c69d6",
      "envelope_digest": "44f9fa43b88b5766db6a04ce4b9127011cccbc0fbddfde5b18e3668809eeb54f"
    },
    "B": {
      "relative_path": "payload/envelope-b-b.json",
      "sha256": "67668773e4b0c81ce6ed1c4dc484f529290a72cb58997ac8354aacf232126cb2",
      "envelope_digest": "177f77e6909240897503233911a4de702db011b25d73c0d9be2ef9050a41af0f"
    }
  },
  "evidence_boundary": {
    "sealed_mapping_visible_to_reviewer": false,
    "model_evidence": true,
    "human_ground_truth": false,
    "human_rating_evidence": false,
    "human_parity_inferred": false,
    "browser_mutation_by_growth": false,
    "provider_publish_by_growth": false
  }
}
